edit_history_tweet_ids,id,text,topic
['1597431965640429568'],1597431965640429568,"@asilveira63 @APaladino @renatajbarreto O STF Anulou a lei ! O Brasil não é mais uma democracia meu amigo, se não for resolvido agora isso daqui vai virar um verdadeiro inferno em 2023!",Democracia
['1597431943456788481'],1597431943456788481,"@Pedriell @veramagalhaes Deixa de ser burro! A democracia jamais será ameaçada pelos bolsonaros. E você, pensando nos seus filhos e netos, também não deveria apoiar um golpe e o fim do estado democrático de direito. Não teve fraude nas eleições!",Democracia
['1597431817380200448'],1597431817380200448,@felipesilva1223 @WagnerThomazoni Já tem um tempo que eu deixei de acreditar na democracia justamente por causa disso. Nossa vida pessoal é influenciada pela escolha desse bando de animais irracionais.,Democracia
['1597431790394019840'],1597431790394019840,"@CamargoDireita A quadrilha resgata a líder no cárcere, pratica uma fraude eleitoral sem precedentes, destrói a democracia d um país p colocar na presidência o líder do bando, o qual veio a falecer, obrigando-os a utilizar um sósia ching ling, mas sem êxito.
Q resultou na prisão dos envolvidos🎯",Democracia
['1597431669493231616'],1597431669493231616,"@ariellediasbr A mto deixou de ser sobre “Bolsonaros” ou “Calheiros” e “Sarneys”, é sobre #GLO   GARANTIA da LEI e da ORDEM, é sobre DEMOCRACIA SIM, COMUNISMO NÃO, é sobre NÃO SER GOVERNADO POR CONDENADOS, é sobre HONRA, PRINCÍPIOS e CARÁTER, é sobre NÓS é sobre o BRASIL!!!     #NAODESISTAM",Democracia
