edit_history_tweet_ids,id,text,topic
['1597438177467564032'],1597438177467564032,"Isso é golpismo! Atentado contra a democracia! Ninguém que ocupa um cargo público, quanto mais um funcionário público como um juiz, tem o direito de se perpetuar no poder, se blindar para fazer o que bem entende sem sofrer consequências. https://t.co/UnFasakBbT",Democracia
['1597437987155226625'],1597437987155226625,@Damadeferroofic Comunistas só falam em democracia. Esquecem que a democracia tem tolerância. Mas o comunismo não é tolerante. Quem não adere seu movimento. É excluído totalmente. No comunismo  não a pluralidade.,Democracia
['1597437940028051458'],1597437940028051458,"@WSarai Pois é, o cumpanhero Hugo CHAVEZ também dizia que não era comunista🤡🤡Já o LARAPIO disse que na Venezuela  tinha “ Democracia demais “ https://t.co/txfyLgZ5E3",Democracia
['1597437927348645888'],1597437927348645888,"@Th3usV1ctor @EduFarah @Rconstantino Voltamos aos bons tempos!
Tancredo vivia as turras com Ulisses, que brigava com Covas, que lutava com Brizola, que esculachava o FHC e Lula divergindo de tudo e todos.
Isso é democracia e política.
Não há um comando central... isso é próprio de governos totalitários.",Democracia
['1597437857676742656'],1597437857676742656,"@jvnunesz Faz o L de democracia e apoia país que mata mulheres por usar um véu errado, lixo",Democracia
['1597437830770601985'],1597437830770601985,"@UOLNoticias Não é democracia. É um monte de besta em frente dos quartéis querendo reverter eleições limpas pedindo golpe, a família Bolsonaro já reconheceu o resultado, mas, usa as bestas pra causar tumulto,digo, O gado, desculpe se magoei.",Democracia
['1597437666643025924'],1597437666643025924,@anitablian Não tem excesso algum. Isso se chama ciência e democracia.,Democracia
['1597437626067619840'],1597437626067619840,"@LulaOficial Vai ex-presidiario 
Lula9 
Você sabe que ganhou com ajuda do Alexandre podre,  e você, está vendo o que o Brasil quer ... Que você preso é pagando pelo seus crime. Pois você não foi absorvido e sim mudado de cidade . Luladrão
Deus
Patrícia
Família 
Democracia
Direito a liberdade",Democracia
['1597437523898220544'],1597437523898220544,"Esta conta 👤 não aceita NENHUMA crítica 😤😤 a purpouffany 🇧🇷. Aqui vivemos uma monarquia 🏰 onde ela é rainha👑. Ela fala 👅, eu escuto👂. Ela pede 🗣️, eu faço 😳. Ela manda 😎, eu obedeço💪. Aqui a palavra dela é lei 😌📃 e não há democracia.",Democracia
['1597437339806334976'],1597437339806334976,"@delucca Kkk...luta pela democracia que eles não aceitam..kk.minions não par mesmo...Enquanto 1 dos integrantes da familicia, está Usufruindo do meu dinheiro e do dele lá no Catar😂😂🤦‍♂️🤦‍♂️",Democracia
['1597437253739245569'],1597437253739245569,"Gil e sua ""democracia"" 🙄 https://t.co/0YxmGlSRER",Democracia
['1597437190325538818'],1597437190325538818,@J_LIVRES São Pedro é a favor da democracia,Democracia
['1597437186424860673'],1597437186424860673,"@RabeloDionatan @DefesaGovBr A democracia venceu, mesmo com as blitz no Nordeste pro povo não conseguir votar
Eu sou eleitora, votei no Lula 
Aceitem a democracia seus golpistas
Nazistas  vc querem é guerra civil pois o exército não pode atender a 49% da população!!!!!",Democracia
['1597437072620785664'],1597437072620785664,"@SigaGazetaBR Todo dia é uma chinelada na cara da democracia provinda de quem não recebeu UM voto! @SenadoFederal e o Pachecú, são os maiores culpados dessa patifaria que virou o Brasil.",Democracia
['1597436989720387585'],1597436989720387585,"É difícil ver as pessoas defendendo a democracia quando o problema não é ela e sim o miliciano, militar borra botas acostumado a embolsar centenas de milhares de reais com desvio de armas e munições que de repente passou a abocanhar milhões esse sujeito não vai largar o osso.",Democracia
['1597436857297801218'],1597436857297801218,@efemenine @Monica61001066 @JudsonLins1 @realpfigueiredo Então vai la e le minhas respostas... respondi a mesma pergunta para duas pessoas diferentes... e ninguem me convenceu de que o Paulo esta a favor do Brasil. Não conseguem resolver nem a democracia dos EUA querem se meter na nossa fazendo o que eles fizeram lá. 🤷‍♀️🤔,Democracia
['1597436504296816641'],1597436504296816641,"@Gigio19461 @keilaBrasilsou1 @realpfigueiredo Só para seu conhecimento não estamos aqui pelos filhos nem pelo pai isso quem diz é os petistas ignorastes, sem conhecimento de constituição federal e de democracia, estamos aqui pelo Brasil e pela pátria pois os direitos fundamentais estão sendo violados, seu seguidor do molusco",Democracia
['1597436453298262018'],1597436453298262018,@4poc4lips3 @JanainaDoBrasil @lussu6 Ensine o que é democracia.,Democracia
['1597436365763137537'],1597436365763137537,"Eu odeio ls branco de Salvador eles são insuportáveis não tenho nenhuma vontade de dialogar, a falsa ideia de democracia racial que Salvador se afundou as vezes me um ódio de ouvir/ler certas coisas. O negro de Salvador não pode ter nem ódio",Democracia
['1597436283453775872'],1597436283453775872,@Emerson_jfs @Patricia1SA Mas para esperar a próxima eleição não precisa ser na frente de quartel... Vão pra casa...sejam oposição e daqui 4 anos tentem ganhar .. isso é legal e se chama democracia .. sempre foi assim... Nem dói...,Democracia
['1597436216814993408'],1597436216814993408,"@gleisi O que e democracia? 
 O que e respeitar os votos?
Porque infligir a lei,e dizer não a parcialidade ?
Porque 1 presidente do TSE ,se envolve no que não é de sua alçada e proíbe tudo e todo de liberdade de expressão. 
Resumindo:Favorecer 1 lado, não eleições não é democracia legal",Democracia
['1597436099508375552'],1597436099508375552,"@R_Vicente1985 @viniciuscfp82 Filhinho, eu sei que vcs estão desorientados e precisando de ajuda psiquiátrica pra superar a negação que sentem pela Vitória do Lula e da Democracia. Mas pra tratar desse transtorno vcs precisam ir pra casa primeiro. Fica calmo que tudo vai dar certo, tá?",Democracia
['1597436014880251906'],1597436014880251906,"@PATRlOTAS A muito tempo isso deixou de ser sobre Bolsonaro ou qualquer político 
ACORDA !! 
no meio das manifestações a conversa é outra É SOBRE DEMOCRACIA É CONTRA  A CENSURA É SOBRE DITADURA DE TOGA 
ACORDA !! 
É  irrelevante Eduardo na copa",Democracia
['1597435999235493888'],1597435999235493888,"@mariacleto22 @LUIZPATRIOTA39 Só se for a liberdade de cometer crimes...contra a democracia, contra o Estado Democrático de Direito, contra a educação, contra as minorias, como vcs vem fazendo há quatro anos... Ô gente canalha!!!!",Democracia
['1597435990628794368'],1597435990628794368,"@MAGELAGR4 Por tudo isso estamos vendo o quão difícil é tirar uma ideologia de 
fascismo do poder 
Não podemos nunca mais deixar isso
Se instalar na democracia brasileira",Democracia
['1597435953194627073'],1597435953194627073,"@NikoIasFerreira A muito tempo isso deixou de ser sobre Bolsonaro ou qualquer político 
no meio das manifestações a conversa é outra É SOBRE DEMOCRACIA É CONTRA  A CENSURA É SOBRE DITADURA DE TOGA 
ACORDA !! 
É  irrelevante Eduardo na copa !",Democracia
['1597435915651416066'],1597435915651416066,"@Amaro_Coronel Não estamos lutando pela família bolsonaro e sim pela família de todos brasileiros. Liberdade,justiça e a verdadeira democracia.",Democracia
['1597435862866071554'],1597435862866071554,@SorayaThronicke A DEMOCRACIA do PT? Maduro concorda com vc.,Democracia
['1597435739830378496'],1597435739830378496,"@SigaGazetaBR Nunca imaginei que a nossa democracia fosse tão frágil. Um simples ministro, faz a lei e executa, estipula o valor de multa e bloqueia a conta de qualquer um, e ninguém pode fazer nada",Democracia
['1597435721375416320'],1597435721375416320,@GuigoodM @MauricioCostaRS Concordo... Mais controle emocional... Aproveitem esses 4 anos sejam oposição e na próxima eleição tentem vencer... Isso é fácil e todo mundo faz isso no Brasil desde as diretas já... Experimentem chama se democracia,Democracia
['1597435678710603776'],1597435678710603776,"@DaniloGentili @BolsonaroSP Narrativas de manipulação do gado, pautas de costumes, conservadoras: familia, pátria, Deus, inimigo comunista, Venezuela/Argentina, fraude eleitoral, STF ditador....manual de como se tornar um tirano, arrebatando os idiotas uteis e atacando a democracia.",Democracia
['1597435674214666240'],1597435674214666240,"@dyana_ferrer Democracia é isso !!
Alguns deles optaram em votar no 22.
Agora sua atitude é semelhante ao povo da Direita, o que foi muito criticado por nós da esquerda.
Reflita sua posição e sugiro até apagar seu post pra não estimular mais gente a fazer o mesmo.

#LulaPresidente2022 https://t.co/jxMdtjs8X4",Democracia
['1597435672549552128'],1597435672549552128,@Ruicpimenta29 Mas tem um setor da esquerda que fica aplaudindo essas arbitrariedades que não entende que é a direita que controla o Estado. São os defensores de que a democracia seja destruída para que seja defendida.,Democracia
['1597435661929177088'],1597435661929177088,"Veja suas reinvindicações, não pedem nada que não seja legítimo, eleições limpas e transparentes como diz a CF, não a censura e o arbítrio, que o STF vem fazendo, desrespeito com a nação e as leis, o povo confiam nas forças armadas com fé em Deus vamos renovar nossa democracia.",Democracia
['1597435650453610497'],1597435650453610497,"Em ato público da 27a Parada LGBTI do Rio de Janeiro @lecibrandaoshow mescla #Zédocaroco e vitória de @LulaOficial com discurso de que : O Brasil acordou e a felicidade do povo vai voltar,viva a liberdade, viva a democracia!. https://t.co/bR1yOerA7K",Democracia
['1597435601951002626'],1597435601951002626,"@LUIZPATRIOTA39 Papo de esquerda idiota, voto no Bolsonaro e viu o filho do Bolsonaro no catar e agora vai apoiar o ladrão. Enfim o ladrão ganhou as eleições no roubo mais ganho e ninguém está lá por Bolsonaro e sim pela democracia do país pq os vagabundos estão querendo tomar o país",Democracia
['1597435589514575875'],1597435589514575875,"@marinatebet Que maravilhosa caraaa !!! 😍😍😍 
Ela corre pela democracia com os sapatos 😂😂😂",Democracia
['1597435509529513984'],1597435509529513984,"@pharaujo85 @silviogrimaldo A muito tempo isso deixou de ser sobre Bolsonaro ou qualquer político 
ACORDA !! 
no meio das manifestações a conversa é outra É SOBRE DEMOCRACIA É CONTRA  A CENSURA É SOBRE DITADURA DE TOGA 
ACORDA !! 
É  irrelevante Eduardo na copa 
PARECE NOTICIA DE FOFOCA AFFS",Democracia
['1597435463367012352'],1597435463367012352,"@LucileneTheo @DanaButlerr @JanainaDoBrasil A pergunta a ser respondida é: por quanto tempo teremos liberdade nas redes sociais?
O 🦑 tem falado em REGULAR a mídia!
O senador saltitante quer criar lei para prender quem critica político.🧐 falas da esquerda = democracia, falas da direita = ataques!",Democracia
['1597435267115540481'],1597435267115540481,Eles realmente acreditam que o molusco é a democracia???... https://t.co/gmEJaesQLb,Democracia
['1597435263743295489'],1597435263743295489,Normalmente o menor IDH são os que lgbts não tem direitos e a democracia foi de arrasta pra cima https://t.co/3yyGiGmS4P,Democracia
['1597435134609100802'],1597435134609100802,"@SorayaThronicke A democracia é representativa como diz a constituição.
Logo vc teoricamente tem o dever de representar seus eleitores.
Não dar lição de moral.
RENUNCIE se não estiver bom pra vc e se candidate de novo pra ver se será eleita de novo.
Não consegue nem ser síndica de prédio.",Democracia
['1597435089105092608'],1597435089105092608,"@joselevi Vosso Livro, na minha humilde opinião, não está sendo condizente com os ditames da nossa Constituição. Veja que não há hierarquia entre os direitos fundamentais e que os princípios norteadores do direito são basilares para decisão nesse caso. Temos então, Liberdade vs Democracia",Democracia
['1597435010906456064'],1597435010906456064,O ataque a democracia neste país esta cada vez mais grave. Google promove a censura contra a revista Oeste e ataque as colunas do J.R. Guzzo. Proíbem a revista de receber anúncios.,Democracia
['1597435003666776066'],1597435003666776066,"@ssocorrosantoss @Waniaportocarre @o_antagonista Interessante o seu banner: Supremo é o povo.

É pra impressionar quem?
Se o povo é supremo, respeite sua soberania.

Querendo dar lição de moral e censurando as pessoas?
Você parece ptralha, eles é que falam em democracia e ficam querendo impor regras.",Democracia
['1597434998747168775'],1597434998747168775,"@BarrosDelegado @palpiteiroprofi @Johnsno89373100 @realpfigueiredo Pronto, agora todos que são contra qualquer golpe à democracia, é petista, me surpreende um delegado pensar assim, confesso que queria ver ""patriotas"" atormentar estes generais e receber o tratamento adequado.",Democracia
['1597434862058688512'],1597434862058688512,"@SergioAJBarrett Se fossem patriota, se quer estariam tentando acabar c a democracia e pedindo intervenção.  Patriota não odeia a pátria.  Isso é bandiotra. Rs",Democracia
['1597434801707155457'],1597434801707155457,"@Rconstantino Como se alguém tivesse na frente do quartel por causa do Bolsonaro e não pela  transparência nas eleições, contra os abusos do TSE/STF, etc!

Quem ama ditador tem dificuldade de entender quem luta por liberdade e democracia plena!",Democracia
['1597434720509636608'],1597434720509636608,@AlexandreAB1979 @kuhhakgo @anaonuno @FabianoLus4 @felipeneto Vc tem que ver direitinho alguns termos para não fazer confusão. Ideais socialistas são diferentes de comunismo ( msm que o comunismo seja uma evolução indireta do socialismo). Qualquer pessoa lúcida que preze pela liberdade e pela democracia não deseja viver um regime socialista,Democracia
['1597434713178005505'],1597434713178005505,"@SilvanaSOlivei5 Nem vc acredita mais nisso. Um conselho...aceitem, sejam oposição, e esperem 4 anos ..todo mundo faz isso e é ótimo ... Se chama democracia",Democracia
['1597434310625480704'],1597434310625480704,@meuvotoehbrasil @SorayaThronicke Defina ( democracia) com acéfalos na frente de quartéis pedindo intervenção militar. Liberdade em governo militar? kkkkkkkk 🤣😂😂😂😂🤣 a falta de conhecimento leva o indivíduo a tolice. A ignorância cava abismo intransponível.,Democracia
['1597434307215491072'],1597434307215491072,"@MBLivre @DaniloGentili Danilo Gentili é óbvio, cada um tem o direito de falar o que pensa, isso é democracia e não ditadura e escravidão. A escravidão acabou a muito tempo, tem gente querendo escravizar ainda.",Democracia
['1597434279554076672'],1597434279554076672,"@Iodelson_Torres @LUIZPATRIOTA39 Meu senhor, vivemos numa democracia, liberdade para escolher o presidente é a mais importante delas todas. Respeite isso e volte pra casa.",Democracia
['1597434217406742528'],1597434217406742528,"@LUIZPATRIOTA39 Parem com isso!!!! Isso acaba desmotivando o nosso movimento. A nossa luta é pela nossa liberdade e democracia. Não queremos que o nosso país seja representado por um ladrão. Entendam!!! Não é sobre Bolsonaro, é a nossa nação em Jogo.",Democracia
['1597434207751372800'],1597434207751372800,@GFiuza_Oficial Chama-se DEMOCRACIA ou querem um segundo golpe,Democracia
['1597434205231017984'],1597434205231017984,"Completando, democracia é aceitar a derrota mesmo que não seja sua vontade, ele ganhou nas urnas, as quais vcs dizem que foi fraudada (absurdo).. então a vontade não é do povo, e sim de minoria que querem dar o golpe https://t.co/9Muhk3Dl7R",Democracia
['1597434202513117184'],1597434202513117184,"Quando dizemos que essa gente, pessedebistas disfarçados de esquerda, estão usando o bolsonarismo para acabar com os direitos democráticos no país, não estamos fantasiando. Vejam essa “defesa da democracia” com penas altíssimas. Democracia agora é a repressão. https://t.co/CPwnEpIzA2",Democracia
['1597434184016211968'],1597434184016211968,"@MarcosOgre Wandinha.
E não aceito que a outra alternativa tenha ganhado, isso aqui não é uma democracia! https://t.co/L4dsFKmnvH",Democracia
['1597434023324045312'],1597434023324045312,@SimoneRJ_BR @ClauGarcia934 Impeachment é prisão de todos os ministros do STF é presidente do senado é congresso isso é formação de quadrilha contra a democracia é povo brasileiro SOS FFAA. STF soltou Lula condenado é que condenar nossa nação ao caoS. STF ó crime compensa.,Democracia
['1597433993926176769'],1597433993926176769,@LUIZPATRIOTA39 Democracia. A escolha ruim que o povo fez vai afetar todos.,Democracia
['1597433973495713792'],1597433973495713792,"@ssocorrosantoss @Waniaportocarre @o_antagonista Estamos em uma democracia, mas pelo jeito você é fã d ditadores d toga, especialmente, aqueles q tornaram o larápio elegivel e Moro suspeito.  Por que os protestos estão lhe incomodando? Viva a liberdade! Eu estou incomodada com a presença d uma quadrilha no poder. 
Fofa? 🤮",Democracia
['1597433959721623552'],1597433959721623552,"@zi_zvi Em uma lógica normal, concordaria. Mas fizera isso anos atrás e foi golpe atrás de golpe. Hoje em dia defendo que a democracia bata bem forte em cima da extrema-direita, na medida em que queira derrubar a democracia com subterfúgios e ardis.",Democracia
['1597433909993562112'],1597433909993562112,"@Beatriz_BBorba @Bubble_blee Mais de 60 milhões de votos, democraticamente a maioria. FA’s sabem de sua responsabilidade constitucional de garantir a democracia. https://t.co/fUUr7FG0IN",Democracia
['1597433885692145665'],1597433885692145665,"@OpressorBob @Juninhobrk2 @liedson808 @UOLNoticias Sem instituições democráticas, não existe democracia.",Democracia
['1597433873750953984'],1597433873750953984,"@monark Esse cara é a escória da humanidade. É impressionante o poder que ele tem em deturpar as coisas! O que ele chama de liberdade de expressão é puro neonazismo disfarçado de democracia, o que ele chama de liberdade é barbárie!",Democracia
['1597433870198022144'],1597433870198022144,"@reporterenato Quando leio golpistas já imagino um bando com camisas verde e amarelas, cantando o hino, não foi esse caso e não deixam de ser golpistas esses também, não atentaram contra a democracia, mas sim contra a idosa.",Democracia
['1597433864632569856'],1597433864632569856,"@veramuller6 @viniciuscfp82 A qual democracia vc se refere?
Eu conheço pouquíssimos eleitores do Lula, e olha que eu conheço muita gente, então lhe pergunto, cadê os 60 milhões de eleitores dele?
Tenha vergonha na face.

Vc seria capaz de roubar?
Em caso positivo, isso explica a razão do seu voto.",Democracia
['1597433772256829440'],1597433772256829440,"@Gilmar19246478 @rafacarrilhor Viva a sua democracia, onde os trâmites de uma eleição foram atropelados. Ativismo judicial, censura e outras aberrações que só vcs fazem, dominaram este pleito.",Democracia
['1597433556783226882'],1597433556783226882,@vaidesmaiar E por quem https://t.co/5gK6mYukdJ for pelo Brasil  a Democracia já ganhou  o  nosso presidente foi eleito  isso e Democracia.,Democracia
['1597433478441709569'],1597433478441709569,"@luizgama1882 @Damadeferroofic Embolsar o dinheiro para comprar poder e para benefícios próprios, afinal pobre se contenta com pouco, e vcs precisam ajustar as ditaduras comunistas que vcs dizem ser exemplos de democracia",Democracia
['1597433464499752960'],1597433464499752960,@UOL Democracia da Globo! Amor da esquerda!,Democracia
['1597433375635406848'],1597433375635406848,"Uma carta escrita por 20 mil pessoas. Um documento HISTÓRICO que coloca o POVO no papel de protagonista, exigindo uma democracia que vai muito além do voto! Leia a carta, assista ao vídeo e se emocione. #CARTAdoPOVO. Você já pode assinar a https://t.co/KUnWRlQjXV
Assine ! #120mil",Democracia
['1597433369440108545'],1597433369440108545,"Palavras finais do  Bolsonaro hoje, 28/11, durante a solenidade de promoção dos oficiais-generais, recem promovidos.      
Juntos e ao lado do maior Exercito do mundo, que é o nosso povo, nós atingiremos nosso objetivo e garantiremos a todos estes a democracia e a liberdade! https://t.co/335z5dqlIJ",Democracia
['1597433368232472577'],1597433368232472577,"Três melancias no caminho da volta à democracia. Melancias podem ser trocadas, ou estou errado?",Democracia
['1597433168780750848'],1597433168780750848,"@JovemPanNews Espero que essa atitude sirva de exemplo para essa democracia parcial que vem massacrando os brasileiros durante os últimos 4 anos !
O  Brasil está em guerra declarada e infelizmente isso é só o começo ,pois o povo vai colocar ORDEM NA CASA!🇧🇷🇧🇷",Democracia
['1597432900659474432'],1597432900659474432,"@Tom__mili @tbaghdadi Vc apoia mulheres não terem direitos a irem em estádios, a não estudar, e tbm serem mortas por usarem um véu errado, isso mostra seu caráter, e depois fica falando de democracia aqui no Brasil",Democracia
['1597432887443587072'],1597432887443587072,"@revistaoeste E assim segue o jogo: fazendo uso do processo democrático, querem usar a lei  para calar, ainda mais, o povo, ""protegendo"" a casta política de ser cobrada por aqueles que o elegeram (o povo, claro).
Um jogo desigual, onde a democracia se torna auto fágica!",Democracia
['1597432860398718976'],1597432860398718976,@PauloRo95121775 @GuilhermeBoulos Então aceita o que o povo escolheu através da democracia e não andar a tentar dar um golpe que nem os BOZOs querem estão no Qatar a mostrar o que são e estão se cagando para vocês,Democracia
['1597432826659381248'],1597432826659381248,"Esta conta 👤 não aceita NENHUMA crítica 😤😤 a seleção brasileira 🇧🇷. Aqui vivemos uma monarquia 🏰 onde ela é rainha 👑. Ela fala 👅, eu escuto 👂. Ela pede 🗣️, eu faço 😳. Ela manda 😎, eu obedeço 💪. Aqui a palavra dela é lei 😌📃 e não há democracia.",Democracia
['1597432796762738688'],1597432796762738688,"A nossa luta continuará sempre a favor e proteção da nossa Democracia.
 Golpe nunca mais,somos guerrilheiros na luta contra o terrorismo. https://t.co/BvnSFYMyO7",Democracia
['1597432771713998848'],1597432771713998848,@AnaZus2019 @AleGZahra38 Impeachment é prisão de todos os ministros do STF é presidente do senado é congresso isso é formação de quadrilha contra a democracia é povo brasileiro SOS FFAA. STF soltou Lula condenado é que condenar nossa nação ao caoS. STF ó crime compensa.,Democracia
['1597432663287422977'],1597432663287422977,"@GFiuza_Oficial Você poderia mostrar provas que ""esse amor"" que falou mudou os votos‼️ Caso contrário é melhor continuar chorando é não postando ataque a democracia sem provas‼️",Democracia
['1597432566193467395'],1597432566193467395,@STF_oficial @CNJ_oficial https://t.co/Iei1Fw2C96 Nos estamos vendo as decisões que estão tomando! Um grande ataque à democracia e a constituição brasileira!,Democracia
['1597432513928269826'],1597432513928269826,"Controle Climático 2030 , olha o carnaval ai minha gente. em breve na democracia mais perto de voce. https://t.co/LEhGUG2Zrm",Democracia
['1597432380192862208'],1597432380192862208,"Brasil pela liberdade, pela democracia,  pela família,  pelo respeito a Constituição e Leis  do Brasil. Traidores não passarão, nenhuma liberdade vem de graça. Deus, Pátria,  Família,  liberdade e verdade. 🇧🇷 https://t.co/xIkOTjzAK4",Democracia
['1597432373922385921'],1597432373922385921,@Iodelson_Torres @LUIZPATRIOTA39 Liberdade???? Nunca vi a democracia tão abalada. O presidente foi eleito pela maioria e isso não vale mais nada??? O atual presidente afirma que é fraude. E quando ele foi eleito??? N teve fraude???,Democracia
['1597432358592204803'],1597432358592204803,"@felipeneto É foca , eleições não se ganha, se toma . A democracia venceu.",Democracia
['1597432324081455105'],1597432324081455105,@ducavendish E quem tá na rua não entendeu nada sobre democracia! Sobre resultado de eleição!,Democracia
['1597432244230295552'],1597432244230295552,"O risco da DEMOCRACIA é ser aniquilada  por quem ""alega protegê-la"". Quando a censura só estado é considerada normal, a democracia está em fase terminal. Quando o devido processo legal é desrespeitado, o estado de direito está na UTI. https://t.co/Gd6ozf4NIE",Democracia
['1597432211648626691'],1597432211648626691,@revistaoeste E assim segue nossa democracia legalmente rumo ao precipício,Democracia
['1597432090114420736'],1597432090114420736,"Alguém aqui falou que o Brasil vai ser Comunista ?

PIB da China terceiro trimestre 2022 - 3,9% 🇨🇳
PIB do Brasil no mesmo período 0,4% 🇧🇷 

Mas não seremos Comunista, o Brasil vai ser uma grande social democracia e o povo vai mostrar como que se desenvolve um Pais ✊🏽🚩 https://t.co/hivtYSmMhd",Democracia
['1597432043344105473'],1597432043344105473,"@arlenes_bac @joicehasselmann Vitória , ou tentativa de Golpe ? Fia perdeu … quem elegeu o presidente atual, foi a maioria das pessoas … A eleição passada foi ele , e ninguém morreu . A democracia é isso … Agora tia não conta essa …",Democracia
['1597432041066434560'],1597432041066434560,@amdconsult3 Bando de desocupado badesneiros terroristas ACEITA A DEMOCRACIA Q DÓI MENOS OU PARA O AFEGANISTÃO,Democracia
['1597432021613445120'],1597432021613445120,@gleisi Essas Forças Armadas serve pra sabotar nossa Democracia. Bora acabar com esse câncer!!!,Democracia
['1597431967426887680'],1597431967426887680,@anazimmer7 @rafacarrilhor Esqueceu de acrescentar: Contra a Democracia.,Democracia
