edit_history_tweet_ids,id,text,topic
['1597437682690723842'],1597437682690723842,@CelioAmorim7 @Estadao @AsbritoMaria @colunadoestadao GANHOU PRÊMIO DA ONU como melhor  GESTOR  E considerado o melhor prefeito da America Latina!👇😅😍😍 https://t.co/GzODn3hF1f,Prefeito
['1597437622330064896'],1597437622330064896,"@AntonioCEvan Esse 🤬 era prefeito da mina cidade… pelo PSDB… no auge da pandemia… ele@fazia eventos de campanha ESCONDIDO com integrantes do partido e funcionários da prefeitura….minha família sem poder fazer eventos e ele usando o espaço…
Pandemia apenas pro povo",Prefeito
['1597436927657279488'],1597436927657279488,"@telassimf @aryvanazzi Que show @telassimf .... Parabéns ao Prefeito @aryvanazzi pela atitude, se eu morasse ai com toda certeza compraria livrinhos pro meu pequeno Raphinha.. 👏👏👏",Prefeito
['1597435880574439425'],1597435880574439425,"eu espero q a população acorde na eleição pra prefeito, se vender custa mto caro, agora tá aí o cara mandando geral embora pq já ganhou o q ele queria, perto da eleição as promessas voltam pq ele vai querer se reeleger, aí vão lá levantar bandeira",Prefeito
['1597435178896437248'],1597435178896437248,O acidente ocorreu por volta das 18h42 e ainda não há dados oficiais sobre feridos ou possíveis vítimas fatais. O prefeito de um município paranaense passava pela BR-376 na hora do deslizamento e quase foi atingido. https://t.co/IvYGv0BF6T,Prefeito
['1597434700704149504'],1597434700704149504,@vivaldobuquerq3 Disfrute bem Seu Prefeito,Prefeito
['1597434473011896321'],1597434473011896321,🤦🏾‍♀️🤦🏾‍♀️🤦🏾‍♀️🤦🏾‍♀️🤦🏾‍♀️🤦🏾‍♀️🤦🏾‍♀️Teoria reforçada por vice-prefeito de Angra diz que Lula morreu. Assessoria rechaça: “Bobagem” | Metrópoles https://t.co/f67QqOqrxD,Prefeito
['1597433700547178496'],1597433700547178496,"Claudio Rocha Jornalista Radialista Assessor de Imprensa e Mediador Conciliador Formado Pelo Ministério da Justiça e Segurança Pública 

https://t.co/81Gs33RsIc",Prefeito
['1597433597786742784'],1597433597786742784,"@mauriciorocha70 Pastor,  e sobre o acidente em Guaratuba? As pessoas estão bem? Vi o depoimento do prefeito, mas não achei nada sobre as outras pessoas…",Prefeito
['1597432915859996672'],1597432915859996672,"@ppatrinni @jogatina222 vdd, um prefeito ia ter mesmo um matador de aluguel como segurança",Prefeito
['1597432716429234176'],1597432716429234176,@NarleyResende O prefeito estava lá e foi Im dos primeiros a passar… 🤔,Prefeito
['1597432350970765313'],1597432350970765313,Cabelo dela ficou prefeito,Prefeito
['1597432029456793601'],1597432029456793601,"esses dias mesmo eu tava super elogiando o prefeito pro meu pai, contando das coisas que ele fez em londrina, na pandemia etc 
mas que errooo, os comentários que ele faz no Twitter dele sobre o que aconteceu na Paranaguá da nojooo",Prefeito
['1597431759703986176'],1597431759703986176,@realpfigueiredo É Paulo depois de declarar amores ao prefeito do Rio Eduardo Paes ficou complicado acreditar em vc como antes!,Prefeito
['1597431217208823808'],1597431217208823808,@erickfigueiredo @Vadilson_Vix @tarcisiogdf @jairbolsonaro São inteligentes sim pois não voto no pior prefeito da história de são Paulo mais sim no melhor ministro de infraestrutura da história do Brasil,Prefeito
['1597430601325608960'],1597430601325608960,@Vadilson_Vix @tarcisiogdf @jairbolsonaro O povo voto no melhor ministro de infraestrutura da história contra o pior prefeito de são Paulo da história,Prefeito
['1597430290778976257'],1597430290778976257,"@Patricia_BR2022 @AlexandraKozama @AntonioCEvan Ex prefeito de Santana de Parnaíba, SP. Elvis Cézar, salvo engano.",Prefeito
['1597430145660469249'],1597430145660469249,"Pelo menos por enquanto, prefere continuar calado  https://t.co/8nN4uW3ETP",Prefeito
['1597429781821554688'],1597429781821554688,Deslizamento de terra atinge carros no PR e prefeito escapa por pouco https://t.co/jvVgACsAcF,Prefeito
['1597429141871394816'],1597429141871394816,"Porra hoje vi a nata do soberana no busao, parece que eu sou prefeito kkkkkkkkkk",Prefeito
['1597428268692811781'],1597428268692811781,"Dos mesmos autores do tratamento precoce e do terra plana, vem aí
O LULA MORREU!

https://t.co/3hsLX3mvb3

Feito sob medida para você que canta o hino para o pneu e acredita no que é dito nas lives do Bolsonaro.",Prefeito
['1597428247952003072'],1597428247952003072,Niterói não tem prefeito 😤 https://t.co/QFB4VnT0xZ,Prefeito
['1597427640843264000'],1597427640843264000,"""Uma coisa horrorosa. A montanha veio abaixo, nos carregou para cima dos outros carros e só estamos vivos por um livramento de Deus"", disse no vídeo. Os Bombeiros Militares de SC atualizaram sobre a atuação da corporação.

https://t.co/GJQtnq5tWR",Prefeito
['1597427342120734720'],1597427342120734720,"O Prefeito menino Guti @guti_oficial + @prefeituraguarulhosoficial fez o favor de tirar todas as grades da Praça Santos Dumont. A praça q antes já estava abandonada, agora está melhor, abandonada sem grades e moradores c/ suas habitações dentro da praça. 

Obrigado menino Guti! https://t.co/RHWSojhvWw",Prefeito
['1597427063384059906'],1597427063384059906,"Dr. Furlan sobre Clécio: ""Ele foi prefeito de Macapá por 8 anos, conhece profundamente os problemas da cidade e que a cidade precisa de apoio do Governo do Estado"" - Portal Amapá https://t.co/5eY2u1y023",Prefeito
['1597426683597901824'],1597426683597901824,Digo é nada... https://t.co/0t1aerepfJ,Prefeito
['1597426244567851008'],1597426244567851008,"@LucianoGiusepp4 Pesquisem sobre o Prefeito Eleito de Goiânia-Go, Maguito Vilela, faleceu logo após o vice tomar posse. Boatos de que ele já estava em outro plano, mas omitiram a verdade até a posse.",Prefeito
['1597425776369860608'],1597425776369860608,"@RichardGMRklan pprt mano, prefeito esqueceu de São Francisco, tem nada aqui",Prefeito
['1597425651111571458'],1597425651111571458,"No #RodaViva, Rodrigo Garcia avalia possibilidade de transporte público gratuito em São Paulo.

O prefeito da capital paulista, Ricardo Nunes, estuda o projeto.

#GarciaNoRodaViva https://t.co/CGh4iYyQAx",Prefeito
['1597425650360532992'],1597425650360532992,Prefeito de São Paulo confirma retorno da festa de Réveillon na Avenida Paulista nesta virada de ano | Jovem Pan #nacional #brazil #brasil #gnnoticias https://t.co/2lU5KYbewC,Prefeito
['1597425608853950465'],1597425608853950465,"Gomez Addams

- 19 anos;
- Filho do prefeito Addams;
- Não gostou da ideia de sair da cidade grande e se instalar num vilarejo estranho;
- Tem o hábito de explorar tudo e roubar coisas;",Prefeito
['1597425598535606274'],1597425598535606274,"@lellybellepi Esse é João Rodrigues atual prefeito de Chapecó ex presidário condenado 5 anos por corrupção, também é o famoso deputado do vídeo pornô, envolvido no famoso caso do assassinato do vereador Marcelino Chiarello. Hoje usa o nome de Bolsonaro pra se manter na política. 🤮",Prefeito
['1597425463915606017'],1597425463915606017,@SilCarqueija @FaimaLima @costa_rui Ele é prefeito de Salvador?,Prefeito
['1597425204988628992'],1597425204988628992,@anadiashedu77 @CechetRegis @LucianoGiusepp4 Esse prefeito é ex presidiário igual o nine.,Prefeito
['1597425186265264128'],1597425186265264128,Ituaçu: Prefeito lamenta tragédia e cobra celeridade de obra na entrada da cidade - https://t.co/IjEgwqlR4U,Prefeito
['1597425126941003776'],1597425126941003776,Vídeo: Prefeito de Guaratuba conta o que viu durante o deslizamento de terra na BR-376: ‘Vivos por livramento de Deus’ https://t.co/lrM9JAR01w,Prefeito
['1597425126748090368'],1597425126748090368,@rodegemeos @realpfigueiredo Inclusive eh bem amigo do Eduardo Paes..aquele prefeito peçonhento do Rio 🤡,Prefeito
['1597424732663865346'],1597424732663865346,"@LarretaNews Pesquisem sobre o Prefeito Eleito de Goiânia-Go, Maguito Vilela, faleceu logo após o vice tomar posse. Boatos de que ele já estava em outro plano, mas omitiram a verdade até a posse.",Prefeito
['1597424684823629824'],1597424684823629824,Fez mais que certo tinha que largar na casa do prefeito se ele apoia essa raça https://t.co/huwmec2IlT,Prefeito
['1597424677454237696'],1597424677454237696,"@LucianoGiusepp4 Esse é João Rodrigues atual prefeito de Chapecó ex presidário condenado 5 anos por corrupção, também é o famoso deputado do vídeo pornô, envolvido no famoso caso do assassinato do vereador Marcelino Chiarello. Hoje usa o nome de Bolsonaro pra se manter na política. 🤮",Prefeito
['1597424670386835456'],1597424670386835456,"Vice-prefeito de Angra dos Reis foi um dos apoiadores do candidato derrotado à reeleição que compartilhou a informação falsa.

Bolsonaristas espalham fake news que Lula morreu e foi trocado por um sósia - Politica - Estado de Minas https://t.co/KMahC3NQnu",Prefeito
['1597424640208818177'],1597424640208818177,@rosana Eu reconheço uma qualidade do Haddad...foi o pior prefeito que sao paulo teve.,Prefeito
['1597424582444867584'],1597424582444867584,eu espero que o prefeito de são cristovão acabe com essa chuva na porrada com as próprias mões dele pq se tiver uma gota de chuva no fasc vcs vão ver uma doida possuída de ódio naquele festival,Prefeito
['1597424436248207360'],1597424436248207360,"dps percebi pq q ela queria falar cmg kkkkkk 

ainda tentou dar umas 2 indiretas sobre bozo qd ignorei totalmente

pois sustente seu vício só amada e se ficar difícil pede p seu presidente e p melhor prefeito do brasil",Prefeito
['1597424173047218177'],1597424173047218177,"@jferreira79 @Fabio_SEP1914 @FelipeDOPT Pq?so vale qndo de Ganha neh? Pq 01/01/19 não fizeram o q estão fazendo hj?pq qndo o.mito ñ elegeu um prefeito de capital ñ veio com esse papo? Pq ñ tentou mudar a lei para corrupção no país?
Simples fato que qndo se ganha não se reclama agora qndo perde chora embaixo da cama!",Prefeito
['1597424121327288321'],1597424121327288321,"@Sa96680844Zilma @NeideAtz Pesquisem sobre o Prefeito Eleito de Goiânia-Go, Maguito Vilela, faleceu logo após o vice tomar posse. Boatos de que ele já estava em outro plano, mas omitiram a verdade até a posse.",Prefeito
['1597424092294295553'],1597424092294295553,Meu deus como assim era o prefeito de guaratuba ali https://t.co/t1DaUQUM0S,Prefeito
['1597423690609672193'],1597423690609672193,"@NeideAtz Pesquisem sobre o Prefeito Eleito de Goiânia-Go, Maguito Vilela, faleceu logo após o vice tomar posse. Boatos de que ele já estava em outro plano, mas omitiram a verdade até a posse.",Prefeito
['1597423417719869441'],1597423417719869441,odiava o prefeito e tô chorando no funeral,Prefeito
['1597423162157068290'],1597423162157068290,@Valdez_xx_ mas que era prefeito né não chapa,Prefeito
['1597422733616623617'],1597422733616623617,"@GFiuza_Oficial Minha cidade é um bom exemplo, todas as urnas são de 2015. Todas as últimas eleições indicam uma fortíssima rejeição ao PT e alinhamento à direita, no entanto, enquanto governador e prefeito de direita foram eleitos com 70% dos votos no primeiro turno +",Prefeito
['1597422459325542400'],1597422459325542400,"@ferreirinharj Secretário, numa conversa na rede social, o senhor garantiu que o prefeito honraria a promessa e daria o reajuste nesse ano. O servidor não  aguenta mais esperar. A prioridade é  a copa?",Prefeito
['1597422107855843329'],1597422107855843329,@allan__lalo @plantao190 @BaixaEssaPorra Esse prefeito deveria estar ajudando o pessoal é não fazendo live !!,Prefeito
['1597421975584280576'],1597421975584280576,Quem não tem o Peu Pereira como prefeito sofre demaisss,Prefeito
['1597421693378908162'],1597421693378908162,@HenriST13 @eu_tertes @mc_1729 Prefeito?,Prefeito
['1597421686436941824'],1597421686436941824,Prefeito de SP viaja ao Uruguai para evento de cidades do Mercosul https://t.co/q6bykFWleS,Prefeito
['1597421475501289472'],1597421475501289472,"@AugustoNPistola Pesquisem sobre o Prefeito Eleito de Goiânia-Go, Maguito Vilela, faleceu logo após o vice tomar posse. Boatos de que ele já estava em outro plano, mas omitiram a verdade até a posse.",Prefeito
['1597421316801728512'],1597421316801728512,VÍDEO – Prefeito do local do deslizamento da BR-376 relata momento de tensão https://t.co/lTga58MgZz,Prefeito
['1597421248149352448'],1597421248149352448,"@medicinaupap Pesquisem sobre o Prefeito Eleito de Goiânia-Go, Maguito Vilela, faleceu logo após o vice tomar posse. Boatos de que ele já estava em outro plano, mas omitiram a verdade até a posse.",Prefeito
['1597420880623448064'],1597420880623448064,"Prefeito de Guaratuba teve o carro atingido por deslizamento na BR-376: “Quebramos os vidros e saímos correndo” 

Tem mais matérias no site do https://t.co/KVGnCrxeh0.
 https://t.co/DYwcC2DtsY",Prefeito
['1597420792836653056'],1597420792836653056,"Uma pena que o Zé Carlos não pode concorrer a prefeito novamente. Ainda admirado que ele instalou estátuas de dinossauro pela Praça dos Carreiros. Quando tirarem o pano de cima, vou fazer um book delas.",Prefeito
['1597420539676528640'],1597420539676528640,"@joaobettega_ E tem gente que deixa de votar em candidato com experiência em gestão pública premiada internacionalmente, professor, ficha limpa, com projetos, novas ideias, que já foi prefeito, governador, ministro e abriu mão das aposentadorias. Parece q não queremos o melhor pro país. Ciro.",Prefeito
['1597420498308444160'],1597420498308444160,@ojamsonmatos Citando Rodrigo Neves como se ele fosse uma grande liderança kkkkkkkkkk o cara só foi prefeito,Prefeito
['1597419767832653825'],1597419767832653825,"Prefeito de Rio dos Cedros decreta situação de emergência https://t.co/S4IFq1vdaT 

#BoaNoiteRioDosCedros #DiárioDeRioDosCedros #RioDosCedros #DonCarlosLeal #NotíciasRioDosCedros #RioDosCedrosDebate #TurismoRioDosCedros #EstadoDeEmergência",Prefeito
['1597419229333987329'],1597419229333987329,@LannesJoseli @bbccssx bolsonaro agora eh prefeito ?,Prefeito
['1597419031568748544'],1597419031568748544,"@UOLNoticias Parece-me q recentemente o atual prefeito conseguiu uma obra junto ao governo do  estado pra solucionar o problema, mas não em tempo hábil pra evitar outra tragédia.",Prefeito
['1597418823287996417'],1597418823287996417,"#MedidaProvisória já nas escolas 
@olazaroramos 
cadê nosso prefeito @eduardopaes ?
bora fazer isso... https://t.co/pKsEdGStBU",Prefeito
['1597418033131442176'],1597418033131442176,"@Reviviane_Re @mariosabinof Diga pq ele é sensacional! Grau de formação, capacidade técnica, feitos como prefeito de SP ... ?

Projetos ? 

Visão de Futuro ?",Prefeito
['1597417563843010561'],1597417563843010561,"#HeadlineNews | Prefeito de Guaratuba estava no deslizamento de terra que aconteceu em rodovia no Paraná

📺 Confira na JP News https://t.co/T5Ol0hgHXW",Prefeito
['1597417232585306113'],1597417232585306113,Prefeito de SP viaja ao Uruguai para evento de cidades do Mercosul https://t.co/7QTDkguGUF https://t.co/wCv502BZF3,Prefeito
['1597416766623604737'],1597416766623604737,Lula já teria morrido e tem um sósia no lugar dele? https://t.co/pun3u4bnOg,Prefeito
['1597415439071485952'],1597415439071485952,Prefeito Adriano Silva pretende vender vice-prefeita para Schröeder pelo valor de até R$ 5 bilhões,Prefeito
['1597415158900740097'],1597415158900740097,"@wearelowdelic fala pra ele q o prefeito de tx é belitardo, né ele n, kkkkkkkkkk e nem mesmo o prefeito vai barrar tu de tocar em tx aspekpkosaepkosae",Prefeito
['1597414747225608194'],1597414747225608194,"A decoração de centavos pro natal da minha cidade, isso foi porque o prefeito roubou 20 milhões, e que fique claro, essa decoração eles usam desde 2020 https://t.co/WTDqeAxM1u",Prefeito
['1597414624361840641'],1597414624361840641,@doutorawh0 HAUHAUAHAUAG PREFEITO,Prefeito
['1597414337119162368'],1597414337119162368,"Tragédia do Km 668 da Estrada de Guaratuba - Garuva- soterramento de carros por deslizamento da escosta de morro! O Prefeito da cidade escabou por segundos! Nao se sabe numero de vitimas. Ambulancias, bombeiros no local",Prefeito
['1597414242105274370'],1597414242105274370,A Enid teve mais química com o filho do prefeito do que esse outro menino,Prefeito
['1597414241539002368'],1597414241539002368,@CechetRegis @LucianoGiusepp4 Verdade. Vejo algumas falas desse Prefeito.,Prefeito
['1597414109473296386'],1597414109473296386,"vou dar meu chute sobre wandinha antes de descobrir a verdade
A mulher ruiva atropelou o prefeito, e na vdd ela é a irmã do cara que o pai da wandinha foi acusado de matar",Prefeito
['1597413388732469248'],1597413388732469248,"Só nessas duas semanas: discuti com o prefeito, a menina do projeto veio me encher pq quer entregar o trabalho sem arrecadar direito as doações pros idosos, fiz mais trabalho, prova, meu ônibus quase foi assaltado, depois quase bateu em outro, gente POR FAVOR https://t.co/iuF5YKHhby",Prefeito
['1597413378796171265'],1597413378796171265,"@rodrigogarcia_ Golpe? Sério isso cara ? Votaria em você para prefeito de São Paulo numa boa , agora vem com essa ? CADE A CARALHA DA DEMOCRACIA DESSA PORRA DE PAÍS DE LADRÃO, CAMBADA DE FDP , ATE ESSES DIAS TAVA FUGINDO DE LADRAO E AGORA VEM PAGAR DE BOM SAMARITANO .... TMNC",Prefeito
['1597412642280333313'],1597412642280333313,Prefeito de Guaratuba/Pr https://t.co/fOxerb0qzb,Prefeito
['1597412606838722560'],1597412606838722560,"Tive o prazer de conhecê-lo pessoalmente pessoalmente e conversarmos por uns 15 minutos sobre o que vi ele fazer, e muito bem, na pandemia em Chapecó, cidade do oeste catarinense que adoro visitar a trabalho ou lazer. Grande prefeito @joaorodriguessc https://t.co/9Hp5VU9XgZ",Prefeito
['1597412560986583040'],1597412560986583040,"@JornalOGlobo Vexame vergonhoso, um sujeito que foi reprovado como prefeito, não sabe nada de economia, virar o ministro da economia.",Prefeito
['1597412313652695041'],1597412313652695041,"Sou eternamente grato por ter conhecido o teu trampo esse ano, graças a ele eu criei amizades incríveis que desejo levar pro resto da vida, e você com ctz é uma delas! Te desejo todo sucesso do mundo e que um dia você ainda vire o prefeito de Jaraguá kkkkkkk",Prefeito
['1597412189140242432'],1597412189140242432,"@UOLNoticias Isso foi aqui na minha cidade.
Um tragédia q se repete há anos por conta de uma ladeira muito íngreme q dá acesso à cidade e nunca foi feito nada a respeito. Parece-me q recentemente o atual prefeito conseguiu uma obra junto ao governo do  estado pra solucionar o problema.",Prefeito
['1597412176402165760'],1597412176402165760,Esperando ver nosso prefeito!!! https://t.co/1rFhXzEU67,Prefeito
['1597412164490645504'],1597412164490645504,@telassimf @aryvanazzi Tem prefeito e tem um coração no comando da prefeitura.,Prefeito
['1597411917223849985'],1597411917223849985,Prefeito de SP viaja ao Uruguai para evento de cidades do Mercosul https://t.co/fexFBuNJfL,Prefeito
['1597411554106175488'],1597411554106175488,Prefeito de SP viaja ao Uruguai para evento de cidades do Mercosul https://t.co/bhlkdDF8oK,Prefeito
['1597411535940456450'],1597411535940456450,Painel: Prefeito de SP viaja ao Uruguai para evento de cidades do Mercosul https://t.co/OcqRBMrt40,Prefeito
['1597411032154210311'],1597411032154210311,Painel: Prefeito de SP viaja ao Uruguai para evento de cidades do Mercosul https://t.co/nGKBYsTiIk,Prefeito
['1597410893352108033'],1597410893352108033,"Pecuarista indignado, leva carcaça de gado que os sem terras abateram de deixa na porta da Prefeitura de Tarabai,  Prefeito e Vice esquerdista. Luladrão nem assumiu e as invasões começaram novamente. Essa história não vai terminar bem o povo não vai aceitar esse apoio ao MST! https://t.co/NzMP5G2hRk",Prefeito
['1597410818106478592'],1597410818106478592,"Boatos que nosso prefeito tá curtindo a #CopaDoMundoFIFA lá no Qatar. Quem pode, pode. #Qatar2022",Prefeito
['1597410602913529856'],1597410602913529856,@vagnerdesouzaop @DeputadoFederal Ele tirou pq o dinheiro q ele pagava o carro pipa o prefeito pegava para ele e nao mandava o carro pipa ..estude mais,Prefeito
['1597410586572521472'],1597410586572521472,"@MarceloBelinati @MarceloBelinati  prefeito na minha humilde opinião o senhor foi o melhor dos últimos 30 anos mas como ninguém é perfeito vai uma reclamação: moro na rua Caracas o meu IPTU esse ano foi R$ 6.500,00 x 2 (apartamentos por andar) x 35 andares = R$ 455.000,00 só o nosso prédio fora",Prefeito
['1597410511036915715'],1597410511036915715,"Carro preto em foto de deslizamento na BR-376 é de prefeito de Guaratuba: ""Escapei por milagre""

https://t.co/HbMM9s9tpP",Prefeito
['1597410493995835394'],1597410493995835394,"@exercitooficial Que tipo de brasileiros compõem as forças armadas. Vocês vão realmente entregar o país para a quadrilha do PT depois de tudo que eles fizeram? Como dizia o bolsonaro, CANALHAS. entre a ditadura do pt e a ditadura dos escoteiros prefeito a dos escoteiros. TRAIDORES DA PATRIA.",Prefeito
['1597409480094150657'],1597409480094150657,"Após a procura de muitos Bageenses, conversas e pedidos, coloco meu nome como Pré Candidato a PREFEITO da nossa cidade em 2024.Criarei um canal onde buscarei idéias, sugestões, críticas, enfim, porque o P que vale para mim é o P de POVO, P de POPULAÇÃO e não de PARTIDOS. https://t.co/NmIrmHgJKw",Prefeito
['1597409257569521667'],1597409257569521667,"Estou tão decepcionada, como vamos aceita uma troca de Paulo Guedes para um Poste da vida, um Fernando Haddad que nada sabe de ECONOMIA , quando foi Prefeito o que fez para a grande  São Paulo?Só Deus na causa e muitas orações .🙏",Prefeito
