edit_history_tweet_ids,id,text,topic
['1597403417949110273'],1597403417949110273,@serradre eu me livrando de simone tebet e soraya thronicke,Soraya Thronicke
['1597402498188210177'],1597402498188210177,"“Tudo tem sua hora, tudo tem seu momento”  

Soraya Thronicke https://t.co/jcbJ0VHcUb",Soraya Thronicke
['1597399802987556864'],1597399802987556864,@vitorialulaaa @diazthalipa Iremos cantar o Hino Nacional para um pneu!! Iremos fazer de tudo para Thais diaz vice de Soraya Thronicke 2026,Soraya Thronicke
['1597399143051591680'],1597399143051591680,"ela mesma a mãe de leo dias, leão lobo, nelson rubens e sonia abrão: soraya thronicke 🤝 https://t.co/PqENJsfi6X",Soraya Thronicke
['1597398047105101824'],1597398047105101824,"Eu tenho muitas informações, algumas relevantes, algumas não, algumas que são apenas uma fofoca simples e outras que são sérias. 

SORAYA THRONICKE https://t.co/H6Fs8yktvj",Soraya Thronicke
['1597394481850224640'],1597394481850224640,"@SorayaThronicke Com certeza o povo do Estado de Mato Grosso do Sul está muito contente com suas ações e omissões, Soraya Thronicke. Não se pode esquecer também das ações e omissões da Simone Tebet.

Esse povo, do Agronegócio e das transportadoras, lembrará das duas.",Soraya Thronicke
['1597390443381428224'],1597390443381428224,@jenhardingx sem condições essa mulher chamada soraya thronicke!,Soraya Thronicke
['1597389996016603137'],1597389996016603137,"@SorayaThronicke Sai da frente quem tem medo, que a Soraya Thronicke tá hablando https://t.co/oIYjQc6YPf",Soraya Thronicke
['1597389972025135104'],1597389972025135104,@SorayaThronicke @BunazarMB Vivi pra ver Soraya Thronicke concordando com o Maicon Kuster.,Soraya Thronicke
['1597384775777800192'],1597384775777800192,"@SorayaThronicke @diazthalipa Eles ainda não entenderam que você não compactua com os mesmos ideias que eles!!
Soraya Thronicke segue afiadíssimaaa😻😻😻😻😻",Soraya Thronicke
['1597383134466969601'],1597383134466969601,EU AMO ESSA SORAYA THRONICKE https://t.co/tPrUqtmARy,Soraya Thronicke
['1597355482892890113'],1597355482892890113,"Ex-candidata à Presidência da República nas eleições de 2022, a senadora Soraya Thronicke (União Brasil) assistiu ao jogo do Brasil contra a Suíça https://t.co/LB5OH8NLU1",Soraya Thronicke
['1597354112844431360'],1597354112844431360,"@SorayaThronicke SAI DA FRENTE QUEM TEM MEDO, PORQUÊ SORAYA THRONICKE NÃO TEM MEDO DE FALAR!!!",Soraya Thronicke
['1597353042369597440'],1597353042369597440,@SorayaThronicke Eita como é boa essa Soraya Thronicke,Soraya Thronicke
['1597348206270373888'],1597348206270373888,KATIA ABREU SENDO GIGANTE E SORAYA THRONICKE SENDO CORRESPONDENTE CHOQUEI DIRETO DO SENADO 🤧🫶 https://t.co/lAgG9DEWDf,Soraya Thronicke
['1597346800696176640'],1597346800696176640,@sw3et_beauty perfeita linda maravilhosa deus SORAYA THRONICKE&gt;&gt;&gt;&gt;&gt;,Soraya Thronicke
['1597340468739997697'],1597340468739997697,"@SorayaThronicke “TODES” EU TE AMO SORAYA THRONICKE, EU TE AMO",Soraya Thronicke
['1597337124621033473'],1597337124621033473,"Citamos alguns exemplos de pseusdos BOLSONARISTA que traíram o Pr.Jair.
Joice, Frota, Soraya Thronicke, irmãos Weintraub, Mouro, Dória, e alguns Generais Melancia, dentre outros que são muitos, que so pensavam nos pomposos $$$$$ errarios, estes eram chamados de BOLSONARISTA.",Soraya Thronicke
['1597331064720363520'],1597331064720363520,simone tebet e soraya thronicke nao me deram tempo pra eu estudar dai vou ter q ativar o plano JK: 5 semanas de aula em 1 madrugada https://t.co/LttJI3XDgY,Soraya Thronicke
['1597327401134215168'],1597327401134215168,Soraya Thronicke massacrando os patriotas 🤣🤣 https://t.co/HuCAOkUYuP,Soraya Thronicke
['1597327135194370049'],1597327135194370049,"@SorayaThroncke @luizinaciolulaa Diretamente das lentes de Soraya Thronicke, nossa nova fotógrafa.",Soraya Thronicke
['1597326966205595649'],1597326966205595649,"A senadora Soraya Thronicke (União) usou o Twitter, nesta segunda-feira (28), para afirmar que os apoiadores do presidente Jair Bolsonaro (PL) precisam acordar.
https://t.co/V45pscyFXx",Soraya Thronicke
['1597314675490066432'],1597314675490066432,"@SorayaThronicke Soraya Thronicke simplesmente a maior do Brasil, hablando sempre. 🗣🗣",Soraya Thronicke
['1597313633905938432'],1597313633905938432,"@SorayaThronicke Reforcem a segurança da Soraya thronicke, pois ela está hablando de novo!! 
@SorayaThronicke  kkkk",Soraya Thronicke
['1597306643968315393'],1597306643968315393,"@LucasLohmann_ @Locklofh serve?

falando nisso, como ta a soraya thronicke?",Soraya Thronicke
['1597300964293500928'],1597300964293500928,"@AS1_mariana @DharMarcelo @choquei ""Eu sai da fila dos que reclamam e fui pra fila dos que fazem""

Candidata Bolson... Digo, Soraya Thronicke",Soraya Thronicke
['1597300204877000705'],1597300204877000705,SEGUREM QUE A SORAYA THRONICKE VOLTOU COM A PEIXEIRA AFIADÍSSIMAAAAAAAAAA AMOOOOO💖💖💖💖💖 https://t.co/oNa8ROr2SU,Soraya Thronicke
['1597299958503591936'],1597299958503591936,@CamilaThronicke @SorayaThronicke Soraya Thronicke é aquela traidora que usou o nome do Bolsonaro pra se eleger? Ah vá...,Soraya Thronicke
['1597297734134149122'],1597297734134149122,"oi gente, sou nova no mundinho soraya thronicke br e queria fazer amizades, ajuda aí dando rt &lt;3",Soraya Thronicke
['1597291445140197379'],1597291445140197379,"Oncinha da soraya mandou uma foto
Senadora soraya thronicke mandou uma mensagem",Soraya Thronicke
['1597280317307760640'],1597280317307760640,Soraya Thronicke já tinha virado onça e feito 44 gols,Soraya Thronicke
['1597276480299753472'],1597276480299753472,@diazthalipa soraya thronicke é vc?,Soraya Thronicke
['1597271778203672577'],1597271778203672577,"Soraya Thronicke, candidata a presidência em 2022, também é presença confirmada

Veja como participar https://t.co/abbwC9zQIO",Soraya Thronicke
['1597266968771690496'],1597266968771690496,"🇧🇷 Candidata à Presidência da República nas eleições de 2022, senadora Soraya Thronicke (União Brasil) assiste ao jogo do Brasil contra a Suíça acompanhada da sua cachorrinha. https://t.co/WFFg2pXPAD",Soraya Thronicke
['1597253708353789952'],1597253708353789952,ninguém consegue explicar a beleza de soraya thronicke https://t.co/aTvf4vwJwO,Soraya Thronicke
['1597251939829358593'],1597251939829358593,"@SorayaThronicke Já dizia Soraya thronicke: que baboseira, que baboseira, que coisa que num, num leva ninguém a nada 
@SorayaThronicke https://t.co/xBjAk6bkeI",Soraya Thronicke
['1597245222903197697'],1597245222903197697,"@diazthalipa A mesma vibe de onde está o Wally, só que com a Soraya thronicke e seu iPhone",Soraya Thronicke
['1597233423508074496'],1597233423508074496,segundou com S de Soraya Thronicke e Simone tebet✨,Soraya Thronicke
['1597223612460957697'],1597223612460957697,bom dia @SorayaThronicke por onde anda Soraya Thronicke???? Um beijo Sorya Thronicke😍😍😍😍 https://t.co/sNSHh1i5wF,Soraya Thronicke
['1597212921204858881'],1597212921204858881,Soraya Thronicke na dm do Fábio de Melo perguntando se ele não tem medo de ir pro inferno,Soraya Thronicke
['1597209115314778112'],1597209115314778112,@SorayaThronicke Soraya Thronicke pq vc sempre responde só os mesmos???,Soraya Thronicke
['1597187418620239872'],1597187418620239872,"Uma transmissão de jogos da Copa do Mundo apenas com candidatos à Presidência da República.

Brasil X Suíça 

Narração: Ciro Gomes
Comentários: Leonardo Péricles e Soraya Thronicke

Com Jair Bolsonaro na Central do Apito",Soraya Thronicke
['1597158884908896257'],1597158884908896257,"Soraya Thronicke sobre multa ao PL: 'Já começaram a pedir o Pix?' https://t.co/pXizGrjjtF ESSE É LIXO DA POLÍTICA,  E SE PEDIR PIX, RECEBE O DOBRO, PQ A SRA, SE PRECISAR, @ MORRE À MÍNGUA",Soraya Thronicke
['1597157933246451714'],1597157933246451714,Soraya Thronicke sobre multa ao PL: 'Já começaram a pedir o Pix?' https://t.co/pXizGrjjtF,Soraya Thronicke
['1597073288865656832'],1597073288865656832,eh que quando no espectro politico temos simone tebet e soraya thronicke eh foda https://t.co/rTQldIGkDf,Soraya Thronicke
['1597058342245257216'],1597058342245257216,O foda da direita é querer empurrar gente como a Simone Tebet e a Soraya Thronicke pro lado de cá.,Soraya Thronicke
['1597052978011459584'],1597052978011459584,1.401 pessoas me seguindo e vendo eu me humilhar pra soraya thronicke,Soraya Thronicke
['1597047665979981826'],1597047665979981826,essa fdp fazendo eu gritar de rir na sala de casaKKKKKKKKKK SORAYA THRONICKE DE MOCHILINJA,Soraya Thronicke
['1597042656714293248'],1597042656714293248,"Como não amar, Soraya Thronicke?💜💜❤️‍🩹💙 https://t.co/XYsxhmnij2",Soraya Thronicke
['1597042089744773120'],1597042089744773120,"@ErikZDC @CathSokoly @Amnis_Fluens @YbleshSammoth Interessante

Deles, eu não sabia

Mas só por título de curiosidade: onde você viu que a Soraya Thronicke é siríaca?",Soraya Thronicke
['1597037417210740737'],1597037417210740737,preciso de uma soraya thronicke e uma simone tebet na minha vida,Soraya Thronicke
['1597026739644833792'],1597026739644833792,@yorkthronicke @SorayaThronicke Sai do fake Soraya Thronicke já descobrimos🤣🤣,Soraya Thronicke
['1597022511895842817'],1597022511895842817,"@SorayaThronicke Olá Srta. Soraya Thronicke, eu quero apenas te dizer que vc intensifica minha alegria diária, torna minha vida mais motivada e me ensina todos os dias um pouquinho sobre a política nacional. Sou muito grata a ti!!! Te amo Yaya ♥️",Soraya Thronicke
['1597016504884920320'],1597016504884920320,"Saudade da @SorayaThronicke, um beijo para a Soraya Thronicke",Soraya Thronicke
['1597009945731698689'],1597009945731698689,soraya thronicke sendo apenas soraya thronicke passando na sua tml pra alegrar a sua noite 💗 https://t.co/WUtcW903hw,Soraya Thronicke
['1597009788876910593'],1597009788876910593,"@JMdeck_ meu sonho eh casar com uma coroa tipo aquela candidata, a soraya thronicke",Soraya Thronicke
['1597003963693662208'],1597003963693662208,"Soraya Thronicke vendo isso: ""PADRE DE FESTA JUNINA"" https://t.co/tijQ0gQBBS",Soraya Thronicke
['1596998443842424832'],1596998443842424832,"Em 2026 eu quero uma disputa eleitoral girl power:
Carla Zambelli e Damares Vice PL
Soraya Thronicke e Micheque vice União
Janja e Tebet vice PT e MDB
Marina Silva e Katia Motosserra Rede
Sofia Manzano e Maria da Conceição Tavares pelo PCB",Soraya Thronicke
['1596984886388486145'],1596984886388486145,"Saudades da Soraya Thronicke, um beijo para Soraya Thronicke 🫶😻

@SorayaThronicke vem hablar com a gente nesse domingão 💜💜💜 https://t.co/gfWbm0j6Yh",Soraya Thronicke
['1596954909739749376'],1596954909739749376,"@digoboxer cê não tem medo de ir pro inferno não? - thronicke,soraya.",Soraya Thronicke
['1596948918738489344'],1596948918738489344,"sugestão de programa: toda semana, durante 1 ou 2 horas, Soraya Thronicke e Padre Kelvin discutem algum tema da atualidade",Soraya Thronicke
['1596930606041944066'],1596930606041944066,@exosalut @childeus exobar e soraya thronicke acabam de perder a namorada https://t.co/G2Y9nto20n,Soraya Thronicke
['1596927834072969218'],1596927834072969218,como que pode Soraya Thronicke ser linda até desse ângulo que normalmente é ingrato com os meros morais... deusa made in olimpo https://t.co/UmT89y97Lf,Soraya Thronicke
['1596921194129010690'],1596921194129010690,"O sorriso dela cura! Amo seu sorriso Soraya Thronicke, amo seu sorriso!❤️‍🩹 https://t.co/IoEVdWKoaZ",Soraya Thronicke
['1596920501682974720'],1596920501682974720,"@EdelciP @SorayaThronicke Ué votou pq quis, e pelo visto nem pesquisou quem é Soraya Thronicke",Soraya Thronicke
['1596914289385668608'],1596914289385668608,@evslynhwgo @SorayaThronicke @yorkthronicke Benza Deus meus amgs benza Deus 🛐 Amém Soraya Thronicke,Soraya Thronicke
['1596910824177938432'],1596910824177938432,Por que o Twitter tá me sugerindo Soraya Thronicke?,Soraya Thronicke
['1596877225814417408'],1596877225814417408,"Soraya também disse que “a aventura antidemocrática fica cada dia mais cara e perigosa”, em referência a constatação das urnas.
#pl #senadora #pix #multa #brasil #politica #stf #uniaobrasil #br #pbpetv @SorayaThronicke 
https://t.co/AlBUbYY9DC",Soraya Thronicke
['1596876265138843649'],1596876265138843649,realmente gente essa panela é um bueiro MAS A GENTE FAZ TUDO POR ELA POR SORAYA THRONICKE A GENTE É RESISTENCIA DENTRO DO LAMAÇAL EU E @stexpectations SOMOS DUAS GUERREIRAS! https://t.co/2UyV7nMhYY,Soraya Thronicke
['1596854276781142016'],1596854276781142016,bom dia simone tebet e soraya thronicke,Soraya Thronicke
['1596851823087788032'],1596851823087788032,"@Leticia75969419 @SorayaThronicke Você nem está entendendo oque ta falando, kkk ninguém aqui ta falando de apoiar SoraYa Thronicke! Quando você entender oque ta falando, a gente conversar.",Soraya Thronicke
['1596849599704358912'],1596849599704358912,"@Miguel_GT17 @Viniciu98406031 @Vedaytos @choquei não vejo uma coisa antidemocrática no lula por isso... senão seria simone tebet, soraya thronicke, etc, antidemocráticos também, né?",Soraya Thronicke
['1596842518800654336'],1596842518800654336,FOI POR ELA POR SORAYA THRONICKE Q EU ENTREI NUMA APOSTA E FUI ROUBADA MAS TUDO BEM ESTAMOS DE VOLTA 👍,Soraya Thronicke
['1596841139998294016'],1596841139998294016,"Agora é ter em vislumbre que se não produzirmos personagens fortes de esquerda, restarão como progressistas a Simone Tebet, o Ciro Gomes, a Soraya Thronicke. O bolsonarismo perdeu a eleição, não morreu. Se os seus forem anistiados, pode esperar uma onda maior ainda em 2026.",Soraya Thronicke
['1596824127922634752'],1596824127922634752,"🚨🚨SORAYA THRONICKE DE CABELO GRANDE🚨🚨

Soraya volta com esse cabelo plmds🥺🥺🥺 https://t.co/E0GUJwQCNA",Soraya Thronicke
['1596783362488012800'],1596783362488012800,"Acordei tipo Soraya Thronicke hoje, bom diaa🙄🙄🙄🙄 https://t.co/9KgLi5um8F",Soraya Thronicke
['1596735901799178241'],1596735901799178241,"o meme que eu fiz da sory ""Dra. Soraya Thronicke cuidará disso"" foi parar lá no gp das kids no ig KKKKKKK amay",Soraya Thronicke
['1596730809427595267'],1596730809427595267,"Mano olha essa bunda que delícia 😋 Coisa linda!

Parabéns Soraya Thronicke https://t.co/FdWjm1z4kv",Soraya Thronicke
['1596718368878657537'],1596718368878657537,@diazthalipa @evslynhwgo @CamilaThronicke @4mxnd4 @sorayasgf Chamada com a soraya thronicke 🥺🥺 queria ter participado 😩,Soraya Thronicke
['1596677815679975424'],1596677815679975424,"@SorayaThronicke Soraya Thronicke é dona do motel com temática de sadomasoquismo, “50 tons de cinzas”

Autor do postPor cgsuporte

Data de publicação26 de setembro de 2022",Soraya Thronicke
['1596645082014388230'],1596645082014388230,"um olhar que diz aquela frase da Soraya Thronicke ""não cutuque uma onça com sua vara curta"" #gaptheseries https://t.co/WJ4oySt3vI",Soraya Thronicke
['1596622236592795648'],1596622236592795648,"soraya thronicke kkkkk esse aqui é meu recado pra você neste sábado.
vamos reagir, senadora! é só um follow 

@SorayaThronicke https://t.co/XbsXFKSgGF",Soraya Thronicke
['1596619975984300037'],1596619975984300037,"@missdiorw @SorayaThronicke Não conhecia a Soraya Thronicke,gostei demais dela no debate em que ela falou pra Bolsonaro não cutucar onça com sua vara curta! Foi muito engraçado!",Soraya Thronicke
['1596617454335234048'],1596617454335234048,Soraya Thronicke sobre multa ao PL: 'Já começaram a pedir o Pix?' https://t.co/m1wSB0XpQ4,Soraya Thronicke
['1596612998730219520'],1596612998730219520,"-Já dizia Soraya Thronicke:
Não tenho paciência pra gente “frouxa”! Homem? Pior ainda!
@SorayaThronicke https://t.co/0gc0iZASij",Soraya Thronicke
['1596611853156655104'],1596611853156655104,🇧🇷✨| Soraya Thronicke falando de violência contra mulher. https://t.co/x6mQpKJadT,Soraya Thronicke
['1596601039201132544'],1596601039201132544,"a soraya thronicke desviando de todos os meus tweets interagindo com ela e pedindo pra ela me seguir de volta 
😍😍😍😍
nao aguento mais 
😍😍😍
https://t.co/PAV3PoAtaC",Soraya Thronicke
['1596598884054306816'],1596598884054306816,Corte rápido? É Soraya Thronicke! 🔪 https://t.co/h9fC7kjZJP,Soraya Thronicke
['1596598793994059777'],1596598793994059777,Soraya Thronicke reafirma que Flávio Bolsonaro pressionou por fim de CPI... https://t.co/MaarhHFBPG via @YouTube,Soraya Thronicke
['1596598338258108417'],1596598338258108417,ninguém tweetando me proporciona tão boas risadas como essa soraya thronicke https://t.co/hHYwdgvEms,Soraya Thronicke
['1596575685664874496'],1596575685664874496,@SorayaThronicke @ThronickeT @caterinacitou Soraya Thronicke eu não sou artista mas faço uns edits seus https://t.co/HUPURj8r4R,Soraya Thronicke
['1596562131377623040'],1596562131377623040,Confeccionem uma camisa com a foto da Soraya Thronicke e eu digo se eu compraria ou não.... https://t.co/QKHonIWfBS,Soraya Thronicke
['1596551771987791872'],1596551771987791872,"@77_frota AÍ DE UMA HORA PRA OUTRA PASSA A APOIAR O LULA, O LULA PÔ. PODIA TER FEITO COMO O CIRO OU SORAYA THRONICKE. CONTRA O BOLSONARO, SEM LAMBER AS BOTAS DO LULA.",Soraya Thronicke
['1596549099318566912'],1596549099318566912,@sw3et_beauty Tão boiola essa Soraya thronicke 🛐🛐,Soraya Thronicke
['1596526722253754370'],1596526722253754370,"A freira disse que é pra eu voltar a ir à missa pois assim, além de obter o perdão, encontrarei um marido. 
Respondi piscando freneticamente com meu delineador glitter. Já tava parecendo a Soraya Thronicke.",Soraya Thronicke
['1596526015920353282'],1596526015920353282,soraya thronicke indicando livro de poesia passando na sua tml https://t.co/MaDiY6XX0e,Soraya Thronicke
['1596521808085549056'],1596521808085549056,Soraya Thronicke entenda que eu te amo kkkkkk #PodSenado https://t.co/zZBt63zHd9,Soraya Thronicke
['1596519035113721858'],1596519035113721858,"Agora que o Bivar anunciou que será candidato da oposição a presidência do Sport, alguns nomes surgem como cotados a fazer parte da equipe: Vice - ACM Neto/Diretora de Futebol - Soraya Thronicke/Diretor Jurídico - Sérgio Moro/Diretor de Finanças - Marcos Cintra...",Soraya Thronicke
